{
  "$schema": "https://json-schema.org/draft/2020-12/schema",
  "$id": "https://example.org/health-nutrition/contracts/journal-export/v6.schema.json",
  "title": "Journal export, schema version 6",
  "description": "A versioned, local export of the journal. Version 6 is version 5 with logged_units: the unit each spoon, cup or fluid-ounce component was logged in. Version 5 is version 4 with kept_out_of_library: the intake ids whose product is kept out of Library > Products, written by a Save to Library choice of off. Version 4 is version 3 with saved_meals. Version 3 is version 2 with two fields added to every revision: the revision's own occurred_at and time_zone, both required and null for a revision recorded before revisions carried their own time. Version 2 is version 1 with a product's kind. Adding or changing any other field means a further schema version; versions 1, 2, 3, 4 and 5 never change shape. Amounts are exact decimal strings in the POSIX format. Unknown amounts are null with value_state unknown, never 0. Every key listed in a required list is always present: a value that is not known is written as null, never left out. Dates are ISO-8601 in UTC with six fractional digits (microseconds). A document written by a version 1 build carries no kind at all, and a reader reads that as food.",
  "type": "object",
  "additionalProperties": false,
  "required": [
    "schema_version",
    "exported_at",
    "app_version",
    "intakes",
    "tombstones",
    "favorites",
    "products",
    "saved_meals",
    "kept_out_of_library",
    "logged_units"
  ],
  "properties": {
    "schema_version": {
      "description": "Version of this schema the document follows. This build writes 6.",
      "const": 6
    },
    "exported_at": {
      "description": "When the export was made, ISO-8601 in UTC.",
      "type": "string",
      "format": "date-time"
    },
    "app_version": {
      "description": "Version string of the app that wrote the export, injected at export time.",
      "type": "string",
      "minLength": 1
    },
    "intakes": {
      "description": "Active intakes, each with every revision, sorted by id.",
      "type": "array",
      "items": {
        "$ref": "#/$defs/intake"
      }
    },
    "tombstones": {
      "description": "Deleted intakes, so a later import can retract them. Sorted by intake_id.",
      "type": "array",
      "items": {
        "$ref": "#/$defs/tombstone"
      }
    },
    "favorites": {
      "description": "Favorite templates, as stored. Sorted by id.",
      "type": "array",
      "items": {
        "$ref": "#/$defs/favorite"
      }
    },
    "products": {
      "description": "Every product snapshot any revision, favorite or saved meal item refers to, sorted by snapshot_id. Revisions also carry their own copy in provenance; this list is what lets a favorite or a saved meal that outlives its intakes be repeated after a restore.",
      "type": "array",
      "items": {
        "$ref": "#/$defs/provenance"
      }
    },
    "saved_meals": {
      "description": "Saved meals, in the list's own order (newest first). Each holds 1 to 30 items, in the order they are logged; the list holds at most 100.",
      "type": "array",
      "maxItems": 100,
      "items": {
        "$ref": "#/$defs/saved_meal"
      }
    },
    "kept_out_of_library": {
      "type": "array",
      "description": "The ids of the intakes whose product is kept out of Library > Products, sorted. Empty when every entry is saved to Library.",
      "items": {
        "type": "string"
      },
      "uniqueItems": true
    },
    "logged_units": {
      "type": "array",
      "description": "The unit each component was logged in, for amounts stored in milliliters that were typed in a spoon, a cup or fluid ounces, sorted by intake_id then component_id. Empty when no entry was logged in such a unit. The amount itself is the stored milliliters.",
      "items": {
        "type": "object",
        "additionalProperties": false,
        "required": [
          "intake_id",
          "component_id",
          "unit"
        ],
        "properties": {
          "intake_id": {
            "type": "string",
            "minLength": 1
          },
          "component_id": {
            "type": "string",
            "minLength": 1
          },
          "unit": {
            "type": "string",
            "enum": [
              "tsp",
              "tbsp",
              "cup",
              "fl oz"
            ]
          }
        }
      }
    }
  },
  "$defs": {
    "intake": {
      "type": "object",
      "additionalProperties": false,
      "required": [
        "id",
        "category",
        "occurred_at",
        "time_zone",
        "meal",
        "note",
        "current_revision",
        "revisions"
      ],
      "properties": {
        "id": {
          "$ref": "#/$defs/intake_id"
        },
        "category": {
          "type": "string",
          "minLength": 1
        },
        "occurred_at": {
          "type": "string",
          "format": "date-time"
        },
        "time_zone": {
          "type": "string",
          "minLength": 1
        },
        "meal": {
          "type": [
            "string",
            "null"
          ]
        },
        "note": {
          "type": [
            "string",
            "null"
          ]
        },
        "current_revision": {
          "type": "integer",
          "minimum": 1
        },
        "revisions": {
          "type": "array",
          "minItems": 1,
          "items": {
            "$ref": "#/$defs/revision"
          }
        }
      }
    },
    "revision": {
      "type": "object",
      "additionalProperties": false,
      "required": [
        "number",
        "created_at",
        "change_reason",
        "product_snapshot_id",
        "provenance",
        "components",
        "occurred_at",
        "time_zone"
      ],
      "properties": {
        "number": {
          "type": "integer",
          "minimum": 1
        },
        "created_at": {
          "type": "string",
          "format": "date-time"
        },
        "change_reason": {
          "type": "string"
        },
        "product_snapshot_id": {
          "type": [
            "string",
            "null"
          ]
        },
        "provenance": {
          "oneOf": [
            {
              "$ref": "#/$defs/provenance"
            },
            {
              "type": "null"
            }
          ]
        },
        "components": {
          "type": "array",
          "minItems": 1,
          "items": {
            "$ref": "#/$defs/component"
          }
        },
        "occurred_at": {
          "description": "When this revision says the intake happened. Null means the intake's own occurred_at, and then time_zone is null too.",
          "type": [
            "string",
            "null"
          ],
          "format": "date-time"
        },
        "time_zone": {
          "description": "The IANA time zone occurred_at was recorded in. Null exactly when occurred_at is null.",
          "type": [
            "string",
            "null"
          ],
          "minLength": 1
        }
      },
      "oneOf": [
        {
          "description": "The revision has its own time: both fields are set.",
          "properties": {
            "occurred_at": {
              "type": "string"
            },
            "time_zone": {
              "type": "string"
            }
          }
        },
        {
          "description": "The revision has no time of its own and means the intake's: both fields are null.",
          "properties": {
            "occurred_at": {
              "type": "null"
            },
            "time_zone": {
              "type": "null"
            }
          }
        }
      ]
    },
    "provenance": {
      "type": "object",
      "additionalProperties": false,
      "required": [
        "snapshot_id",
        "product_id",
        "name",
        "brand",
        "barcode",
        "label_basis",
        "catalog_origin",
        "catalog_version",
        "kind"
      ],
      "properties": {
        "snapshot_id": {
          "type": "string",
          "minLength": 1
        },
        "product_id": {
          "type": "string",
          "minLength": 1
        },
        "name": {
          "type": "string",
          "minLength": 1
        },
        "brand": {
          "type": [
            "string",
            "null"
          ]
        },
        "barcode": {
          "type": [
            "string",
            "null"
          ]
        },
        "label_basis": {
          "type": "string",
          "minLength": 1
        },
        "catalog_origin": {
          "type": "string",
          "minLength": 1
        },
        "catalog_version": {
          "type": "string",
          "minLength": 1
        },
        "kind": {
          "description": "What kind of product this is. A supplement states what is in a supplement rather than what is in a food, and a reader leaves it out of a count of the day's foods; it is still summed into the day's totals.",
          "enum": [
            "food",
            "drink",
            "supplement"
          ]
        }
      }
    },
    "component": {
      "type": "object",
      "additionalProperties": false,
      "required": [
        "component_id",
        "name",
        "amount",
        "unit",
        "value_state"
      ],
      "properties": {
        "component_id": {
          "type": "string",
          "pattern": "^[a-z0-9][a-z0-9._-]{0,63}$"
        },
        "name": {
          "type": "string"
        },
        "amount": {
          "description": "Exact decimal text, or null when the value state is unknown. The two are tied together by oneOf: known means decimal text, unknown means null.",
          "type": [
            "string",
            "null"
          ]
        },
        "unit": {
          "type": "string",
          "minLength": 1
        },
        "value_state": {
          "enum": [
            "known",
            "unknown"
          ]
        }
      },
      "oneOf": [
        {
          "title": "Known amount",
          "properties": {
            "amount": {
              "type": "string",
              "pattern": "^-?[0-9]+(\\.[0-9]+)?$"
            },
            "value_state": {
              "const": "known"
            }
          }
        },
        {
          "title": "Missing amount",
          "properties": {
            "amount": {
              "type": "null"
            },
            "value_state": {
              "const": "unknown"
            }
          }
        }
      ]
    },
    "tombstone": {
      "type": "object",
      "additionalProperties": false,
      "required": [
        "intake_id",
        "revision",
        "occurred_at",
        "time_zone"
      ],
      "properties": {
        "intake_id": {
          "$ref": "#/$defs/intake_id"
        },
        "revision": {
          "type": "integer",
          "minimum": 1
        },
        "occurred_at": {
          "type": "string",
          "format": "date-time"
        },
        "time_zone": {
          "type": "string",
          "minLength": 1
        }
      }
    },
    "favorite": {
      "type": "object",
      "additionalProperties": false,
      "required": [
        "id",
        "display_name",
        "category",
        "meal",
        "product_snapshot_id",
        "components"
      ],
      "properties": {
        "id": {
          "type": "string",
          "minLength": 1
        },
        "display_name": {
          "type": "string",
          "minLength": 1
        },
        "category": {
          "type": "string",
          "minLength": 1
        },
        "meal": {
          "type": [
            "string",
            "null"
          ]
        },
        "product_snapshot_id": {
          "type": [
            "string",
            "null"
          ]
        },
        "components": {
          "type": "array",
          "items": {
            "$ref": "#/$defs/component"
          }
        }
      }
    },
    "intake_id": {
      "type": "string",
      "pattern": "^[0-9a-f]{8}-[0-9a-f]{4}-[0-9a-f]{4}-[0-9a-f]{4}-[0-9a-f]{12}$"
    },
    "saved_meal": {
      "type": "object",
      "additionalProperties": false,
      "required": [
        "id",
        "name",
        "meal",
        "items"
      ],
      "properties": {
        "id": {
          "type": "string",
          "minLength": 1
        },
        "name": {
          "description": "1 to 60 characters once outer spaces are trimmed, counted as the app counts characters; unique in the list, ignoring case.",
          "type": "string",
          "minLength": 1
        },
        "meal": {
          "description": "The meal the group was saved under, or null for none.",
          "type": [
            "string",
            "null"
          ],
          "enum": [
            "breakfast",
            "lunch",
            "dinner",
            "snack",
            null
          ]
        },
        "items": {
          "description": "Templates shaped like a favorite, each with a null meal: the group's meal applies to all of them.",
          "type": "array",
          "minItems": 1,
          "maxItems": 30,
          "items": {
            "$ref": "#/$defs/saved_meal_item"
          }
        }
      }
    },
    "saved_meal_item": {
      "description": "A saved meal's item: a favorite's shape whose meal is always null, since the group's meal applies to every item.",
      "type": "object",
      "additionalProperties": false,
      "required": [
        "id",
        "display_name",
        "category",
        "meal",
        "product_snapshot_id",
        "components"
      ],
      "properties": {
        "id": {
          "type": "string",
          "minLength": 1
        },
        "display_name": {
          "type": "string",
          "minLength": 1
        },
        "category": {
          "type": "string",
          "minLength": 1
        },
        "meal": {
          "type": "null"
        },
        "product_snapshot_id": {
          "type": [
            "string",
            "null"
          ]
        },
        "components": {
          "type": "array",
          "items": {
            "$ref": "#/$defs/component"
          },
          "minItems": 1
        }
      }
    }
  }
}
